{
  "chapter": 6,
  "titleEn": "Electronic Structure and Periodic Properties of Elements",
  "titleIs": null,
  "sections": [],
  "images": {
    "total": null,
    "translated": 0,
    "status": "not-started"
  },
  "notes": "Not started",
  "status": {
    "extraction": {
      "complete": true,
      "date": "2026-01-12"
    },
    "mtReady": {
      "complete": true,
      "date": "2026-03-14"
    },
    "mtOutput": {
      "complete": false
    },
    "linguisticReview": {
      "complete": false
    },
    "tmCreated": {
      "complete": false
    },
    "injection": {
      "complete": false
    },
    "rendering": {
      "complete": false
    },
    "publication": {
      "mtPreview": {
        "complete": false
      },
      "faithful": {
        "complete": false
      },
      "localized": {
        "complete": false
      }
    }
  }
}
